{
  "attributes": {
    "0500": [
      "Controller",
      {
        "Clsd": "Closed",
        "Comp": "Computer",
        "Humn": "User",
        "Open": "Open"
      }
    ],
    "1000": [
      "Rules",
      {
        "Dflt": "Default"
      }
    ],
    "1001": [
      "Premade Game",
      {
        "no": "No",
        "yes": "Yes"
      }
    ],
    "2000": [
      "Teams",
      {
        "Cust": "Custom Teams",
        "FFA": "Free For All",
        "FFAT": "Free For All Teams",
        "t1": "1 Team",
        "t10": "10 Teams",
        "t11": "11 Teams",
        "t2": "2 Teams",
        "t3": "3 Teams",
        "t4": "4 Teams",
        "t5": "5 Teams",
        "t6": "6 Teams",
        "t7": "7 Teams",
        "t8": "8 Teams",
        "t9": "9 Teams"
      }
    ],
    "2001": [
      "Teams",
      {
        "1v1": "1v1",
        "2v2": "2v2",
        "3v3": "3v3",
        "4v4": "4v4",
        "5v5": "5v5",
        "6v6": "6v6",
        "FFA": "FFA"
      }
    ],
    "2002": [
      "Teams1v1",
      {
        "T1": "Team 1",
        "T2": "Team 2"
      }
    ],
    "2003": [
      "Teams2v2",
      {
        "T1": "Team 1",
        "T2": "Team 2"
      }
    ],
    "2004": [
      "Teams3v3",
      {
        "T1": "Team 1",
        "T2": "Team 2"
      }
    ],
    "2005": [
      "Teams4v4",
      {
        "T1": "Team 1",
        "T2": "Team 2"
      }
    ],
    "2006": [
      "TeamsFFA",
      {
        "T1": "Team 1",
        "T10": "Team 10",
        "T11": "Team 11",
        "T12": "Team 12",
        "T13": "Team 13",
        "T14": "Team 14",
        "T15": "Team 15",
        "T2": "Team 2",
        "T3": "Team 3",
        "T4": "Team 4",
        "T5": "Team 5",
        "T6": "Team 6",
        "T7": "Team 7",
        "T8": "Team 8",
        "T9": "Team 9"
      }
    ],
    "2007": [
      "Teams5v5",
      {
        "T1": "Team 1",
        "T2": "Team 2"
      }
    ],
    "2008": [
      "Teams6v6",
      {
        "T1": "Team 1",
        "T2": "Team 2"
      }
    ],
    "2010": [
      "Team",
      {
        "T1": "Team 1"
      }
    ],
    "2011": [
      "Teams7v7",
      {
        "T1": "Team 1",
        "T2": "Team 2"
      }
    ],
    "2012": [
      "Team",
      {
        "T1": "Team 1",
        "T2": "Team 2",
        "T3": "Team 3"
      }
    ],
    "2013": [
      "Team",
      {
        "T1": "Team 1",
        "T2": "Team 2",
        "T3": "Team 3",
        "T4": "Team 4"
      }
    ],
    "2014": [
      "Team",
      {
        "T1": "Team 1",
        "T2": "Team 2",
        "T3": "Team 3",
        "T4": "Team 4",
        "T5": "Team 5"
      }
    ],
    "2015": [
      "Team",
      {
        "T1": "Team 1",
        "T2": "Team 2",
        "T3": "Team 3",
        "T4": "Team 4",
        "T5": "Team 5",
        "T6": "Team 6"
      }
    ],
    "2016": [
      "Team",
      {
        "T1": "Team 1",
        "T2": "Team 2",
        "T3": "Team 3",
        "T4": "Team 4",
        "T5": "Team 5",
        "T6": "Team 6",
        "T7": "Team 7"
      }
    ],
    "2017": [
      "Team",
      {
        "T1": "Team 1",
        "T10": "Team 10",
        "T11": "Team 11",
        "T12": "Team 12",
        "T13": "Team 13",
        "T14": "Team 14",
        "T15": "Team 15",
        "T2": "Team 2",
        "T3": "Team 3",
        "T4": "Team 4",
        "T5": "Team 5",
        "T6": "Team 6",
        "T7": "Team 7",
        "T8": "Team 8",
        "T9": "Team 9"
      }
    ],
    "2018": [
      "Team",
      {
        "T1": "Team 1",
        "T10": "Team 10",
        "T11": "Team 11",
        "T12": "Team 12",
        "T13": "Team 13",
        "T14": "Team 14",
        "T15": "Team 15",
        "T2": "Team 2",
        "T3": "Team 3",
        "T4": "Team 4",
        "T5": "Team 5",
        "T6": "Team 6",
        "T7": "Team 7",
        "T8": "Team 8",
        "T9": "Team 9"
      }
    ],
    "2019": [
      "Team",
      {
        "T1": "Team 1",
        "T2": "Team 2",
        "T3": "Team 3",
        "T4": "Team 4",
        "T5": "Team 5",
        "T6": "Team 6",
        "T7": "Team 7",
        "T8": "Team 8"
      }
    ],
    "2020": [
      "Team",
      {
        "T1": "Team 1",
        "T2": "Team 2",
        "T3": "Team 3",
        "T4": "Team 4",
        "T5": "Team 5",
        "T6": "Team 6",
        "T7": "Team 7",
        "T8": "Team 8",
        "T9": "Team 9"
      }
    ],
    "2021": [
      "Team",
      {
        "T1": "Team 1",
        "T10": "Team 10",
        "T2": "Team 2",
        "T3": "Team 3",
        "T4": "Team 4",
        "T5": "Team 5",
        "T6": "Team 6",
        "T7": "Team 7",
        "T8": "Team 8",
        "T9": "Team 9"
      }
    ],
    "2022": [
      "Team",
      {
        "T1": "Team 1",
        "T10": "Team 10",
        "T11": "Team 11",
        "T2": "Team 2",
        "T3": "Team 3",
        "T4": "Team 4",
        "T5": "Team 5",
        "T6": "Team 6",
        "T7": "Team 7",
        "T8": "Team 8",
        "T9": "Team 9"
      }
    ],
    "3000": [
      "Game Speed",
      {
        "Fasr": "Faster",
        "Fast": "Fast",
        "Norm": "Normal",
        "Slor": "Slower",
        "Slow": "Slow"
      }
    ],
    "3001": [
      "Race",
      {
        "Prot": "Protoss",
        "RAND": "Random",
        "Terr": "Terran",
        "Zerg": "Zerg"
      }
    ],
    "3002": [
      "Color",
      {
        "tc01": "Red",
        "tc02": "Blue",
        "tc03": "Teal",
        "tc04": "Purple",
        "tc05": "Yellow",
        "tc06": "Orange",
        "tc07": "Green",
        "tc08": "Light Pink",
        "tc09": "Violet",
        "tc10": "Light Grey",
        "tc11": "Dark Green",
        "tc12": "Brown",
        "tc13": "Light Green",
        "tc14": "Dark Grey",
        "tc15": "Pink",
        "tc16": "??"
      }
    ],
    "3003": [
      "Handicap",
      {
        "100": "100%",
        "50": "50%",
        "60": "60%",
        "70": "70%",
        "80": "80%",
        "90": "90%"
      }
    ],
    "3004": [
      "Difficulty",
      {
        "ChRe": "Cheater 2 (Resources)",
        "ChVi": "Cheater 1 (Vision)",
        "Easy": "Easy",
        "Hard": "Harder",
        "HdVH": "Very Hard",
        "Insa": "Insane",
        "MdHd": "Hard",
        "Medi": "Medium",
        "VyEy": "Very Easy",
        "VyHd": "Elite"
      }
    ],
    "3006": [
      "Lobby Delay",
      {
        "10": "10",
        "15": "15",
        "20": "20",
        "25": "25",
        "3": "3",
        "30": "30",
        "5": "5",
        "7": "7"
      }
    ],
    "3007": [
      "Participant Role",
      {
        "Part": "Participant",
        "Watc": "Observer"
      }
    ],
    "3008": [
      "Observer Type",
      {
        "Obs": "Spectator",
        "Ref": "Referee"
      }
    ],
    "3009": [
      "Game Mode",
      {
        "": "Single Player",
        "Amm": "Ladder",
        "Priv": "Private",
        "Pub": "Public"
      }
    ],
    "3010": [
      "Locked Alliances",
      {
        "no": "No",
        "yes": "Yes"
      }
    ],
    "3011": [
      "Player Logo Index",
      {
        "0": "0",
        "1": "1",
        "10": "10",
        "100": "100",
        "101": "101",
        "102": "102",
        "103": "103",
        "104": "104",
        "105": "105",
        "106": "106",
        "107": "107",
        "108": "108",
        "109": "109",
        "11": "11",
        "110": "110",
        "111": "111",
        "112": "112",
        "113": "113",
        "114": "114",
        "115": "115",
        "116": "116",
        "117": "117",
        "118": "118",
        "119": "119",
        "12": "12",
        "120": "120",
        "121": "121",
        "122": "122",
        "123": "123",
        "124": "124",
        "125": "125",
        "126": "126",
        "127": "127",
        "128": "128",
        "129": "129",
        "13": "13",
        "130": "130",
        "131": "131",
        "132": "132",
        "133": "133",
        "134": "134",
        "135": "135",
        "136": "136",
        "137": "137",
        "138": "138",
        "139": "139",
        "14": "14",
        "140": "140",
        "141": "141",
        "142": "142",
        "143": "143",
        "144": "144",
        "145": "145",
        "146": "146",
        "147": "147",
        "148": "148",
        "149": "149",
        "15": "15",
        "150": "150",
        "151": "151",
        "152": "152",
        "153": "153",
        "154": "154",
        "155": "155",
        "156": "156",
        "157": "157",
        "158": "158",
        "159": "159",
        "16": "16",
        "160": "160",
        "161": "161",
        "162": "162",
        "163": "163",
        "164": "164",
        "165": "165",
        "166": "166",
        "167": "167",
        "168": "168",
        "169": "169",
        "17": "17",
        "170": "170",
        "171": "171",
        "172": "172",
        "173": "173",
        "174": "174",
        "175": "175",
        "176": "176",
        "177": "177",
        "178": "178",
        "179": "179",
        "18": "18",
        "180": "180",
        "181": "181",
        "182": "182",
        "183": "183",
        "184": "184",
        "185": "185",
        "186": "186",
        "187": "187",
        "188": "188",
        "189": "189",
        "19": "19",
        "190": "190",
        "191": "191",
        "192": "192",
        "193": "193",
        "194": "194",
        "195": "195",
        "196": "196",
        "197": "197",
        "198": "198",
        "199": "199",
        "2": "2",
        "20": "20",
        "200": "200",
        "201": "201",
        "202": "202",
        "203": "203",
        "204": "204",
        "205": "205",
        "206": "206",
        "207": "207",
        "208": "208",
        "209": "209",
        "21": "21",
        "210": "210",
        "211": "211",
        "212": "212",
        "213": "213",
        "214": "214",
        "215": "215",
        "216": "216",
        "217": "217",
        "218": "218",
        "219": "219",
        "22": "22",
        "220": "220",
        "221": "221",
        "222": "222",
        "223": "223",
        "224": "224",
        "225": "225",
        "226": "226",
        "227": "227",
        "228": "228",
        "229": "229",
        "23": "23",
        "230": "230",
        "231": "231",
        "232": "232",
        "233": "233",
        "234": "234",
        "235": "235",
        "236": "236",
        "237": "237",
        "238": "238",
        "239": "239",
        "24": "24",
        "240": "240",
        "241": "241",
        "242": "242",
        "243": "243",
        "244": "244",
        "245": "245",
        "246": "246",
        "247": "247",
        "248": "248",
        "249": "249",
        "25": "25",
        "250": "250",
        "251": "251",
        "252": "252",
        "253": "253",
        "254": "254",
        "255": "255",
        "26": "26",
        "27": "27",
        "28": "28",
        "29": "29",
        "3": "3",
        "30": "30",
        "31": "31",
        "32": "32",
        "33": "33",
        "34": "34",
        "35": "35",
        "36": "36",
        "37": "37",
        "38": "38",
        "39": "39",
        "4": "4",
        "40": "40",
        "41": "41",
        "42": "42",
        "43": "43",
        "44": "44",
        "45": "45",
        "46": "46",
        "47": "47",
        "48": "48",
        "49": "49",
        "5": "5",
        "50": "50",
        "51": "51",
        "52": "52",
        "53": "53",
        "54": "54",
        "55": "55",
        "56": "56",
        "57": "57",
        "58": "58",
        "59": "59",
        "6": "6",
        "60": "60",
        "61": "61",
        "62": "62",
        "63": "63",
        "64": "64",
        "65": "65",
        "66": "66",
        "67": "67",
        "68": "68",
        "69": "69",
        "7": "7",
        "70": "70",
        "71": "71",
        "72": "72",
        "73": "73",
        "74": "74",
        "75": "75",
        "76": "76",
        "77": "77",
        "78": "78",
        "79": "79",
        "8": "8",
        "80": "80",
        "81": "81",
        "82": "82",
        "83": "83",
        "84": "84",
        "85": "85",
        "86": "86",
        "87": "87",
        "88": "88",
        "89": "89",
        "9": "9",
        "90": "90",
        "91": "91",
        "92": "92",
        "93": "93",
        "94": "94",
        "95": "95",
        "96": "96",
        "97": "97",
        "98": "98",
        "99": "99"
      }
    ],
    "3102": [
      "AI Build",
      {
        "AB00": "Any Build",
        "AB02": "Full Rush",
        "AB03": "Timing Attack",
        "AB04": "Aggressive Push",
        "AB05": "Economic Focus",
        "AB06": "Straight to Air"
      }
    ],
    "3103": [
      "AI Build",
      {
        "AB00": "Any Build",
        "AB02": "Full Rush",
        "AB03": "Timing Attack",
        "AB04": "Aggressive Push",
        "AB05": "Economic Focus",
        "AB06": "Straight to Air"
      }
    ],
    "3104": [
      "AI Build",
      {
        "AB00": "Any Build",
        "AB02": "Full Rush",
        "AB03": "Timing Attack",
        "AB04": "Aggressive Push",
        "AB05": "Economic Focus",
        "AB06": "Straight to Air"
      }
    ],
    "3105": [
      "AI Build",
      {
        "AB00": "Any Build",
        "AB02": "Full Rush",
        "AB03": "Timing Attack",
        "AB04": "Aggressive Push",
        "AB05": "Economic Focus",
        "AB06": "Straight to Air"
      }
    ],
    "3106": [
      "AI Build",
      {
        "AB00": "Any Build",
        "AB02": "Full Rush",
        "AB03": "Timing Attack",
        "AB04": "Aggressive Push",
        "AB05": "Economic Focus",
        "AB06": "Straight to Air"
      }
    ],
    "3107": [
      "AI Build",
      {
        "AB00": "Any Build",
        "AB02": "Full Rush",
        "AB03": "Timing Attack",
        "AB04": "Aggressive Push",
        "AB05": "Economic Focus",
        "AB06": "Straight to Air"
      }
    ],
    "3108": [
      "AI Build",
      {
        "AB00": "Any Build",
        "AB02": "Full Rush",
        "AB03": "Timing Attack",
        "AB04": "Aggressive Push",
        "AB05": "Economic Focus",
        "AB06": "Straight to Air"
      }
    ],
    "3109": [
      "AI Build",
      {
        "AB00": "Any Build",
        "AB02": "Full Rush",
        "AB03": "Timing Attack",
        "AB04": "Aggressive Push",
        "AB05": "Economic Focus",
        "AB06": "Straight to Air"
      }
    ],
    "3110": [
      "AI Build",
      {
        "AB00": "Any Build",
        "AB02": "Full Rush",
        "AB03": "Timing Attack",
        "AB04": "Aggressive Push",
        "AB05": "Economic Focus",
        "AB06": "Straight to Air"
      }
    ],
    "3111": [
      "AI Build",
      {
        "AB00": "Any Build",
        "AB02": "Full Rush",
        "AB03": "Timing Attack",
        "AB04": "Aggressive Push",
        "AB05": "Economic Focus",
        "AB06": "Straight to Air"
      }
    ],
    "3134": [
      "AI Build",
      {
        "AB00": "Any Build",
        "AB02": "Full Rush",
        "AB03": "Timing Attack",
        "AB04": "Aggressive Push",
        "AB05": "Economic Focus",
        "AB06": "Straight to Air"
      }
    ],
    "3135": [
      "AI Build",
      {
        "AB00": "Any Build",
        "AB02": "Full Rush",
        "AB03": "Timing Attack",
        "AB04": "Aggressive Push",
        "AB05": "Economic Focus",
        "AB06": "Straight to Air"
      }
    ],
    "3136": [
      "AI Build",
      {
        "AB00": "Any Build",
        "AB02": "Full Rush",
        "AB03": "Timing Attack",
        "AB04": "Aggressive Push",
        "AB05": "Economic Focus",
        "AB06": "Straight to Air"
      }
    ],
    "3137": [
      "AI Build",
      {
        "AB00": "Any Build",
        "AB02": "Full Rush",
        "AB03": "Timing Attack",
        "AB04": "Aggressive Push",
        "AB05": "Economic Focus",
        "AB06": "Straight to Air"
      }
    ],
    "3138": [
      "AI Build",
      {
        "AB00": "Any Build",
        "AB02": "Full Rush",
        "AB03": "Timing Attack",
        "AB04": "Aggressive Push",
        "AB05": "Economic Focus",
        "AB06": "Straight to Air"
      }
    ],
    "3139": [
      "AI Build (Terran)",
      {
        "AB00": "Any Build",
        "AB02": "Full Rush",
        "AB03": "Timing Attack",
        "AB04": "Aggressive Push",
        "AB05": "Economic Focus",
        "AB06": "Straight to Air",
        "AB43": "MarineStim (Timing)",
        "AB44": "MarauderHellion (Timing)",
        "AB45": "MarineSiege (Timing)",
        "AB46": "CloakBanshee (Timing)",
        "AB48": "MMM (Aggressive)",
        "AB49": "MarineSiege (Aggressive)",
        "AB50": "SiegeBanshee (Aggressive)",
        "AB51": "HellionSiege (Aggressive)",
        "AB52": "SiegeThor (Aggressive)",
        "AB54": "BioMMM (Economic)",
        "AB55": "Mech (Economic)",
        "AB56": "ThorBC (Economic)"
      }
    ],
    "3140": [
      "AI Build (Terran)",
      {
        "AB00": "Any Build",
        "AB02": "Full Rush",
        "AB03": "Timing Attack",
        "AB04": "Aggressive Push",
        "AB05": "Economic Focus",
        "AB06": "Straight to Air",
        "AB43": "MarineStim (Timing)",
        "AB44": "MarauderHellion (Timing)",
        "AB45": "MarineSiege (Timing)",
        "AB46": "CloakBanshee (Timing)",
        "AB48": "MMM (Aggressive)",
        "AB49": "MarineSiege (Aggressive)",
        "AB50": "SiegeBanshee (Aggressive)",
        "AB51": "HellionSiege (Aggressive)",
        "AB52": "SiegeThor (Aggressive)",
        "AB54": "BioMMM (Economic)",
        "AB55": "Mech (Economic)",
        "AB56": "ThorBC (Economic)"
      }
    ],
    "3141": [
      "AI Build (Terran)",
      {
        "AB00": "Any Build",
        "AB02": "Full Rush",
        "AB03": "Timing Attack",
        "AB04": "Aggressive Push",
        "AB05": "Economic Focus",
        "AB06": "Straight to Air",
        "AB43": "MarineStim (Timing)",
        "AB44": "MarauderHellion (Timing)",
        "AB45": "MarineSiege (Timing)",
        "AB46": "CloakBanshee (Timing)",
        "AB48": "MMM (Aggressive)",
        "AB49": "MarineSiege (Aggressive)",
        "AB50": "SiegeBanshee (Aggressive)",
        "AB51": "HellionSiege (Aggressive)",
        "AB52": "SiegeThor (Aggressive)",
        "AB54": "BioMMM (Economic)",
        "AB55": "Mech (Economic)",
        "AB56": "ThorBC (Economic)"
      }
    ],
    "3142": [
      "AI Build (Terran)",
      {
        "AB00": "Any Build",
        "AB02": "Full Rush",
        "AB03": "Timing Attack",
        "AB04": "Aggressive Push",
        "AB05": "Economic Focus",
        "AB06": "Straight to Air",
        "AB43": "MarineStim (Timing)",
        "AB44": "MarauderHellion (Timing)",
        "AB45": "MarineSiege (Timing)",
        "AB46": "CloakBanshee (Timing)",
        "AB48": "MMM (Aggressive)",
        "AB49": "MarineSiege (Aggressive)",
        "AB50": "SiegeBanshee (Aggressive)",
        "AB51": "HellionSiege (Aggressive)",
        "AB52": "SiegeThor (Aggressive)",
        "AB54": "BioMMM (Economic)",
        "AB55": "Mech (Economic)",
        "AB56": "ThorBC (Economic)"
      }
    ],
    "3143": [
      "AI Build (Terran)",
      {
        "AB00": "Any Build",
        "AB02": "Full Rush",
        "AB03": "Timing Attack",
        "AB04": "Aggressive Push",
        "AB05": "Economic Focus",
        "AB06": "Straight to Air",
        "AB43": "MarineStim (Timing)",
        "AB44": "MarauderHellion (Timing)",
        "AB45": "MarineSiege (Timing)",
        "AB46": "CloakBanshee (Timing)",
        "AB48": "MMM (Aggressive)",
        "AB49": "MarineSiege (Aggressive)",
        "AB50": "SiegeBanshee (Aggressive)",
        "AB51": "HellionSiege (Aggressive)",
        "AB52": "SiegeThor (Aggressive)",
        "AB54": "BioMMM (Economic)",
        "AB55": "Mech (Economic)",
        "AB56": "ThorBC (Economic)"
      }
    ],
    "3166": [
      "AI Build",
      {
        "AB00": "Any Build",
        "AB02": "Full Rush",
        "AB03": "Timing Attack",
        "AB04": "Aggressive Push",
        "AB05": "Economic Focus",
        "AB06": "Straight to Air"
      }
    ],
    "3167": [
      "AI Build",
      {
        "AB00": "Any Build",
        "AB02": "Full Rush",
        "AB03": "Timing Attack",
        "AB04": "Aggressive Push",
        "AB05": "Economic Focus",
        "AB06": "Straight to Air"
      }
    ],
    "3168": [
      "AI Build",
      {
        "AB00": "Any Build",
        "AB02": "Full Rush",
        "AB03": "Timing Attack",
        "AB04": "Aggressive Push",
        "AB05": "Economic Focus",
        "AB06": "Straight to Air"
      }
    ],
    "3169": [
      "AI Build",
      {
        "AB00": "Any Build",
        "AB02": "Full Rush",
        "AB03": "Timing Attack",
        "AB04": "Aggressive Push",
        "AB05": "Economic Focus",
        "AB06": "Straight to Air"
      }
    ],
    "3170": [
      "AI Build",
      {
        "AB00": "Any Build",
        "AB02": "Full Rush",
        "AB03": "Timing Attack",
        "AB04": "Aggressive Push",
        "AB05": "Economic Focus",
        "AB06": "Straight to Air"
      }
    ],
    "3171": [
      "AI Build (Protoss)",
      {
        "AB00": "Any Build",
        "AB02": "Full Rush",
        "AB03": "Timing Attack",
        "AB04": "Aggressive Push",
        "AB05": "Economic Focus",
        "AB06": "Straight to Air",
        "AB64": "WarpGate (Timing)",
        "AB65": "StalkerRobo (Timing)",
        "AB66": "Blink Stalker (Timing)",
        "AB67": "Dark Templar Rush (Timing)",
        "AB69": "SevenGate (Aggressive)",
        "AB70": "GateImmortal (Aggressive)",
        "AB71": "Colossi (Aggressive)",
        "AB72": "GatewayAir (Aggressive)",
        "AB73": "VoidPhoenix (Aggressive)",
        "AB75": "GateImmortal (Economic)",
        "AB76": "Colossi (Economic)",
        "AB77": "GatewayAir (Economic)"
      }
    ],
    "3172": [
      "AI Build (Protoss)",
      {
        "AB00": "Any Build",
        "AB02": "Full Rush",
        "AB03": "Timing Attack",
        "AB04": "Aggressive Push",
        "AB05": "Economic Focus",
        "AB06": "Straight to Air",
        "AB64": "WarpGate (Timing)",
        "AB65": "StalkerRobo (Timing)",
        "AB66": "Blink Stalker (Timing)",
        "AB67": "Dark Templar Rush (Timing)",
        "AB69": "SevenGate (Aggressive)",
        "AB70": "GateImmortal (Aggressive)",
        "AB71": "Colossi (Aggressive)",
        "AB72": "GatewayAir (Aggressive)",
        "AB73": "VoidPhoenix (Aggressive)",
        "AB75": "GateImmortal (Economic)",
        "AB76": "Colossi (Economic)",
        "AB77": "GatewayAir (Economic)"
      }
    ],
    "3173": [
      "AI Build (Protoss)",
      {
        "AB00": "Any Build",
        "AB02": "Full Rush",
        "AB03": "Timing Attack",
        "AB04": "Aggressive Push",
        "AB05": "Economic Focus",
        "AB06": "Straight to Air",
        "AB64": "WarpGate (Timing)",
        "AB65": "StalkerRobo (Timing)",
        "AB66": "Blink Stalker (Timing)",
        "AB67": "Dark Templar Rush (Timing)",
        "AB69": "SevenGate (Aggressive)",
        "AB70": "GateImmortal (Aggressive)",
        "AB71": "Colossi (Aggressive)",
        "AB72": "GatewayAir (Aggressive)",
        "AB73": "VoidPhoenix (Aggressive)",
        "AB75": "GateImmortal (Economic)",
        "AB76": "Colossi (Economic)",
        "AB77": "GatewayAir (Economic)"
      }
    ],
    "3174": [
      "AI Build (Protoss)",
      {
        "AB00": "Any Build",
        "AB02": "Full Rush",
        "AB03": "Timing Attack",
        "AB04": "Aggressive Push",
        "AB05": "Economic Focus",
        "AB06": "Straight to Air",
        "AB64": "WarpGate (Timing)",
        "AB65": "StalkerRobo (Timing)",
        "AB66": "Blink Stalker (Timing)",
        "AB67": "Dark Templar Rush (Timing)",
        "AB69": "SevenGate (Aggressive)",
        "AB70": "GateImmortal (Aggressive)",
        "AB71": "Colossi (Aggressive)",
        "AB72": "GatewayAir (Aggressive)",
        "AB73": "VoidPhoenix (Aggressive)",
        "AB75": "GateImmortal (Economic)",
        "AB76": "Colossi (Economic)",
        "AB77": "GatewayAir (Economic)"
      }
    ],
    "3175": [
      "AI Build (Protoss)",
      {
        "AB00": "Any Build",
        "AB02": "Full Rush",
        "AB03": "Timing Attack",
        "AB04": "Aggressive Push",
        "AB05": "Economic Focus",
        "AB06": "Straight to Air",
        "AB64": "WarpGate (Timing)",
        "AB65": "StalkerRobo (Timing)",
        "AB66": "Blink Stalker (Timing)",
        "AB67": "Dark Templar Rush (Timing)",
        "AB69": "SevenGate (Aggressive)",
        "AB70": "GateImmortal (Aggressive)",
        "AB71": "Colossi (Aggressive)",
        "AB72": "GatewayAir (Aggressive)",
        "AB73": "VoidPhoenix (Aggressive)",
        "AB75": "GateImmortal (Economic)",
        "AB76": "Colossi (Economic)",
        "AB77": "GatewayAir (Economic)"
      }
    ],
    "3198": [
      "AI Build",
      {
        "AB00": "Any Build",
        "AB02": "Full Rush",
        "AB03": "Timing Attack",
        "AB04": "Aggressive Push",
        "AB05": "Economic Focus",
        "AB06": "Straight to Air"
      }
    ],
    "3199": [
      "AI Build",
      {
        "AB00": "Any Build",
        "AB02": "Full Rush",
        "AB03": "Timing Attack",
        "AB04": "Aggressive Push",
        "AB05": "Economic Focus",
        "AB06": "Straight to Air"
      }
    ],
    "3200": [
      "AI Build",
      {
        "AB00": "Any Build",
        "AB02": "Full Rush",
        "AB03": "Timing Attack",
        "AB04": "Aggressive Push",
        "AB05": "Economic Focus",
        "AB06": "Straight to Air"
      }
    ],
    "3201": [
      "AI Build",
      {
        "AB00": "Any Build",
        "AB02": "Full Rush",
        "AB03": "Timing Attack",
        "AB04": "Aggressive Push",
        "AB05": "Economic Focus",
        "AB06": "Straight to Air"
      }
    ],
    "3202": [
      "AI Build",
      {
        "AB00": "Any Build",
        "AB02": "Full Rush",
        "AB03": "Timing Attack",
        "AB04": "Aggressive Push",
        "AB05": "Economic Focus",
        "AB06": "Straight to Air"
      }
    ],
    "3203": [
      "AI Build (Zerg)",
      {
        "AB00": "Any Build",
        "AB02": "Full Rush",
        "AB03": "Timing Attack",
        "AB04": "Aggressive Push",
        "AB05": "Economic Focus",
        "AB06": "Straight to Air",
        "AB23": "BaneLing Bust (Timing)",
        "AB24": "Roach Rush (Timing)",
        "AB25": "LingRoach (Timing)",
        "AB27": "Mutalisk (Aggressive)",
        "AB28": "MutaLing (Aggressive)",
        "AB29": "RoachAttack (Aggressive)",
        "AB30": "RoachInfestor (Aggressive)",
        "AB31": "RoachHydra (Aggressive)",
        "AB34": "Infestor (Economic)",
        "AB35": "Ultralisk (Economic)",
        "AB36": "Brood Lord (Economic)"
      }
    ],
    "3204": [
      "AI Build (Zerg)",
      {
        "AB00": "Any Build",
        "AB02": "Full Rush",
        "AB03": "Timing Attack",
        "AB04": "Aggressive Push",
        "AB05": "Economic Focus",
        "AB06": "Straight to Air",
        "AB23": "BaneLing Bust (Timing)",
        "AB24": "Roach Rush (Timing)",
        "AB25": "LingRoach (Timing)",
        "AB27": "Mutalisk (Aggressive)",
        "AB28": "MutaLing (Aggressive)",
        "AB29": "RoachAttack (Aggressive)",
        "AB30": "RoachInfestor (Aggressive)",
        "AB31": "RoachHydra (Aggressive)",
        "AB34": "Infestor (Economic)",
        "AB35": "Ultralisk (Economic)",
        "AB36": "Brood Lord (Economic)"
      }
    ],
    "3205": [
      "AI Build (Zerg)",
      {
        "AB00": "Any Build",
        "AB02": "Full Rush",
        "AB03": "Timing Attack",
        "AB04": "Aggressive Push",
        "AB05": "Economic Focus",
        "AB06": "Straight to Air",
        "AB23": "BaneLing Bust (Timing)",
        "AB24": "Roach Rush (Timing)",
        "AB25": "LingRoach (Timing)",
        "AB27": "Mutalisk (Aggressive)",
        "AB28": "MutaLing (Aggressive)",
        "AB29": "RoachAttack (Aggressive)",
        "AB30": "RoachInfestor (Aggressive)",
        "AB31": "RoachHydra (Aggressive)",
        "AB34": "Infestor (Economic)",
        "AB35": "Ultralisk (Economic)",
        "AB36": "Brood Lord (Economic)"
      }
    ],
    "3206": [
      "AI Build (Zerg)",
      {
        "AB00": "Any Build",
        "AB02": "Full Rush",
        "AB03": "Timing Attack",
        "AB04": "Aggressive Push",
        "AB05": "Economic Focus",
        "AB06": "Straight to Air",
        "AB23": "BaneLing Bust (Timing)",
        "AB24": "Roach Rush (Timing)",
        "AB25": "LingRoach (Timing)",
        "AB27": "Mutalisk (Aggressive)",
        "AB28": "MutaLing (Aggressive)",
        "AB29": "RoachAttack (Aggressive)",
        "AB30": "RoachInfestor (Aggressive)",
        "AB31": "RoachHydra (Aggressive)",
        "AB34": "Infestor (Economic)",
        "AB35": "Ultralisk (Economic)",
        "AB36": "Brood Lord (Economic)"
      }
    ],
    "3207": [
      "AI Build (Zerg)",
      {
        "AB00": "Any Build",
        "AB02": "Full Rush",
        "AB03": "Timing Attack",
        "AB04": "Aggressive Push",
        "AB05": "Economic Focus",
        "AB06": "Straight to Air",
        "AB23": "BaneLing Bust (Timing)",
        "AB24": "Roach Rush (Timing)",
        "AB25": "LingRoach (Timing)",
        "AB27": "Mutalisk (Aggressive)",
        "AB28": "MutaLing (Aggressive)",
        "AB29": "RoachAttack (Aggressive)",
        "AB30": "RoachInfestor (Aggressive)",
        "AB31": "RoachHydra (Aggressive)",
        "AB34": "Infestor (Economic)",
        "AB35": "Ultralisk (Economic)",
        "AB36": "Brood Lord (Economic)"
      }
    ],
    "4000": [
      "Game Privacy",
      {
        "NoBO": "No Build Order",
        "NoMH": "No Match History",
        "Norm": "Normal"
      }
    ],
    "4001": [
      "Using Custom Observer UI",
      {
        "no": "Not Using Custom Observer UI",
        "yes": "Using Custom Observer UI"
      }
    ]
  },
  "decisions": "(dp0\nc__builtin__\nfrozenset\np1\n((lp2\nS'Mutalisk (Aggressive)'\np3\na(I3206\nVAB27\np4\ntp5\naVPure Mutalisk (Aggressive)\np6\natp7\nRp8\ng3\nsg1\n((lp9\nS'Hard'\np10\naVHarder\np11\na(I3004\nS'Hard'\np12\ntp13\natp14\nRp15\ng11\nsg1\n((lp16\n(I2001\nS'1v1'\np17\ntp18\naS'1 v 1'\np19\naV1v1\np20\natp21\nRp22\ng20\nsg1\n((lp23\n(I3104\nS'AB04'\np24\ntp25\naS'Agressive Push'\np26\naVAggressive Push\np27\natp28\nRp29\ng27\nsg1\n((lp30\nS'Agressive Push'\np31\naVAggressive Push\np32\na(I3199\nS'AB04'\np33\ntp34\natp35\nRp36\ng32\nsg1\n((lp37\nV6v6\np38\naS'6 v 6'\np39\na(I2001\nS'6v6'\np40\ntp41\natp42\nRp43\ng38\nsg1\n((lp44\nS'Agressive Push'\np45\na(I3102\nS'AB04'\np46\ntp47\naVAggressive Push\np48\natp49\nRp50\ng48\nsg1\n((lp51\nS'Mutalisk (Aggressive)'\np52\na(I3207\nVAB27\np53\ntp54\naVPure Mutalisk (Aggressive)\np55\natp56\nRp57\ng52\nsg1\n((lp58\nVArchonImmortal (Aggressive)\np59\naS'GateImmortal (Aggressive)'\np60\na(I3172\nVAB70\np61\ntp62\natp63\nRp64\ng60\nsg1\n((lp65\nI2003\naVTeams2v2\np66\naS'Team'\np67\natp68\nRp69\ng66\nsg1\n((lp70\nVLadder\np71\naS'Automated Match Making'\np72\na(I3009\nS'Amm'\np73\ntp74\natp75\nRp76\ng71\nsg1\n((lp77\n(I2001\nS'5v5'\np78\ntp79\naS'5 v 5'\np80\naV5v5\np81\natp82\nRp83\ng81\nsg1\n((lp84\nS'WarpGate (Timing)'\np85\na(I3174\nVAB64\np86\ntp87\naVFourGate (Timing)\np88\natp89\nRp90\ng85\nsg1\n((lp91\nS'Mutalisk (Aggressive)'\np92\naVPure Mutalisk (Aggressive)\np93\na(I3205\nVAB27\np94\ntp95\natp96\nRp97\ng92\nsg1\n((lp98\n(I3203\nVAB27\np99\ntp100\naS'Mutalisk (Aggressive)'\np101\naVPure Mutalisk (Aggressive)\np102\natp103\nRp104\ng101\nsg1\n((lp105\nI3141\naVAI Build (Terran)\np106\naS'AI Build'\np107\natp108\nRp109\ng106\nsg1\n((lp110\nVArchonImmortal (Aggressive)\np111\naS'GateImmortal (Aggressive)'\np112\na(I3173\nVAB70\np113\ntp114\natp115\nRp116\ng112\nsg1\n((lp117\n(I2001\nS'3v3'\np118\ntp119\naS'3 v 3'\np120\naV3v3\np121\natp122\nRp123\ng121\nsg1\n((lp124\n(I3168\nS'AB04'\np125\ntp126\naS'Agressive Push'\np127\naVAggressive Push\np128\natp129\nRp130\ng128\nsg1\n((lp131\n(I3200\nS'AB04'\np132\ntp133\naS'Agressive Push'\np134\naVAggressive Push\np135\natp136\nRp137\ng135\nsg1\n((lp138\nVAI Build (Protoss)\np139\naI3174\naS'AI Build'\np140\natp141\nRp142\ng139\nsg1\n((lp143\nS'Very Hard'\np144\naVElite\np145\na(I3004\nS'VyHd'\np146\ntp147\natp148\nRp149\ng145\nsg1\n((lp150\nS'Agressive Push'\np151\naVAggressive Push\np152\na(I3167\nS'AB04'\np153\ntp154\natp155\nRp156\ng152\nsg1\n((lp157\nI3204\naS'AI Build'\np158\naVAI Build (Zerg)\np159\natp160\nRp161\ng159\nsg1\n((lp162\nVInsane\np163\naS'Cheater 3 (Insane)'\np164\na(I3004\nS'Insa'\np165\ntp166\natp167\nRp168\ng163\nsg1\n((lp169\nS'Mutalisk (Aggressive)'\np170\naVPure Mutalisk (Aggressive)\np171\na(I3204\nVAB27\np172\ntp173\natp174\nRp175\ng170\nsg1\n((lp176\n(I3007\nS'Watc'\np177\ntp178\naS'Observer'\np179\naS'Watcher'\np180\natp181\nRp182\ng179\nsg1\n((lp183\nI3205\naVAI Build (Zerg)\np184\naS'AI Build'\np185\natp186\nRp187\ng184\nsg1\n((lp188\n(I3171\nVAB64\np189\ntp190\naS'WarpGate (Timing)'\np191\naVFourGate (Timing)\np192\natp193\nRp194\ng191\nsg1\n((lp195\nVTeams5v5\np196\naS'Team'\np197\naI2007\natp198\nRp199\ng196\nsg1\n((lp200\nI3171\naVAI Build (Protoss)\np201\naS'AI Build'\np202\natp203\nRp204\ng201\nsg1\n((lp205\nS'Unknown'\np206\naI2012\naS'Team'\np207\natp208\nRp209\ng207\nsg1\n((lp210\n(I3172\nVAB64\np211\ntp212\naS'WarpGate (Timing)'\np213\naVFourGate (Timing)\np214\natp215\nRp216\ng213\nsg1\n((lp217\nI3173\naS'AI Build'\np218\naVAI Build (Protoss)\np219\natp220\nRp221\ng219\nsg1\n((lp222\nVAI Build (Terran)\np223\naI3142\naS'AI Build'\np224\natp225\nRp226\ng223\nsg1\n((lp227\nI3172\naVAI Build (Protoss)\np228\naS'AI Build'\np229\natp230\nRp231\ng228\nsg1\n((lp232\nS'Level 1 (Very Easy)'\np233\na(I3004\nS'VyEy'\np234\ntp235\naVVery Easy\np236\natp237\nRp238\ng236\nsg1\n((lp239\nS'Agressive Push'\np240\naVAggressive Push\np241\na(I3135\nS'AB04'\np242\ntp243\natp244\nRp245\ng241\nsg1\n((lp246\nV2v2\np247\naS'2 v 2'\np248\na(I2001\nS'2v2'\np249\ntp250\natp251\nRp252\ng247\nsg1\n((lp253\nS'Agressive Push'\np254\na(I3166\nS'AB04'\np255\ntp256\naVAggressive Push\np257\natp258\nRp259\ng257\nsg1\n((lp260\nVArchonImmortal (Aggressive)\np261\na(I3175\nVAB70\np262\ntp263\naS'GateImmortal (Aggressive)'\np264\natp265\nRp266\ng264\nsg1\n((lp267\nVTeamsFFA\np268\naI2006\naS'Team'\np269\natp270\nRp271\ng268\nsg1\n((lp272\nS'AI Build'\np273\naVAI Build (Terran)\np274\naI3143\natp275\nRp276\ng274\nsg1\n((lp277\n(I3171\nVAB70\np278\ntp279\naVArchonImmortal (Aggressive)\np280\naS'GateImmortal (Aggressive)'\np281\natp282\nRp283\ng281\nsg1\n((lp284\nVTeams7v7\np285\naI2011\naS'Team'\np286\natp287\nRp288\ng285\nsg1\n((lp289\nS'WarpGate (Timing)'\np290\na(I3175\nVAB64\np291\ntp292\naVFourGate (Timing)\np293\natp294\nRp295\ng290\nsg1\n((lp296\nS'WarpGate (Timing)'\np297\na(I3173\nVAB64\np298\ntp299\naVFourGate (Timing)\np300\natp301\nRp302\ng297\nsg1\n((lp303\nVMedium\np304\naS'Level 3 (Medium)'\np305\na(I3004\nS'Medi'\np306\ntp307\natp308\nRp309\ng304\nsg1\n((lp310\nI3140\naS'AI Build'\np311\naVAI Build (Terran)\np312\natp313\nRp314\ng312\nsg1\n((lp315\nVTeams4v4\np316\naI2005\naS'Team'\np317\natp318\nRp319\ng316\nsg1\n((lp320\nS'Agressive Push'\np321\na(I3198\nS'AB04'\np322\ntp323\naVAggressive Push\np324\natp325\nRp326\ng324\nsg1\n((lp327\nVArchonImmortal (Aggressive)\np328\na(I3174\nVAB70\np329\ntp330\naS'GateImmortal (Aggressive)'\np331\natp332\nRp333\ng331\nsg1\n((lp334\n(I3136\nS'AB04'\np335\ntp336\naS'Agressive Push'\np337\naVAggressive Push\np338\natp339\nRp340\ng338\nsg1\n((lp341\nI2008\naVTeams6v6\np342\naS'Team'\np343\natp344\nRp345\ng342\nsg1\n((lp346\nS'Agressive Push'\np347\naVAggressive Push\np348\na(I3103\nS'AB04'\np349\ntp350\natp351\nRp352\ng348\nsg1\n((lp353\nV4v4\np354\naS'4 v 4'\np355\na(I2001\nS'4v4'\np356\ntp357\natp358\nRp359\ng354\nsg1\n((lp360\nS'Agressive Push'\np361\na(I3134\nS'AB04'\np362\ntp363\naVAggressive Push\np364\natp365\nRp366\ng364\nsg1\n((lp367\nVTeams1v1\np368\naI2002\naS'Team'\np369\natp370\nRp371\ng368\nsg1\n((lp372\nI3139\naS'AI Build'\np373\naVAI Build (Terran)\np374\natp375\nRp376\ng374\nsg1\n((lp377\nS'AI Build'\np378\naVAI Build (Zerg)\np379\naI3207\natp380\nRp381\ng379\nsg1\n((lp382\n(I2001\nS'FFA'\np383\ntp384\naS'Free For All'\np385\naVFFA\np386\natp387\nRp388\ng386\nsg1\n((lp389\nVAI Build (Zerg)\np390\naI3206\naS'AI Build'\np391\natp392\nRp393\ng390\nsg1\n((lp394\nVTeams3v3\np395\naI2004\naS'Team'\np396\natp397\nRp398\ng395\nsg1\n((lp399\nVAI Build (Protoss)\np400\naS'AI Build'\np401\naI3175\natp402\nRp403\ng400\nsg1\n((lp404\nS'Level 2 (Easy)'\np405\na(I3004\nS'Easy'\np406\ntp407\naVEasy\np408\natp409\nRp410\ng408\nsg1\n((lp411\nI3203\naS'AI Build'\np412\naVAI Build (Zerg)\np413\natp414\nRp415\ng413\ns."
}
